,sentence,rhetoric
Only in art will the lion lie down with the lamb.,Inversion,Inversion
Never have I ever seen such a beautiful sunset.,Inversion,Inversion
Over the hill and through the woods to grandmother's house we go.,Inversion,Inversion
Rarely do we see such strength and courage in one individual.,Inversion,Inversion
"With a sharp blade and steady hand, the surgeon completed the delicate procedure.",Inversion,Inversion
"In a world of chaos, peace can still be found within oneself.",Inversion,Inversion
"In my bag, I have only pencils and paper."" (normal word order: ""I have only pencils and paper in my bag."")",Inversion,Inversion
"Never have I seen such a beautiful sunset."" (normal word order: ""I have never seen such a beautiful sunset."")",Inversion,Inversion
"On top of the mountain stood a majestic oak tree."" (normal word order: ""A majestic oak tree stood on top of the mountain."")",Inversion,Inversion
"Of my fears, I have only one."" (normal word order: ""I have only one fear."")",Inversion,Inversion
"Into the darkness, he stepped."" (normal word order: ""He stepped into the darkness."")",Inversion,Inversion
"The book, I cannot put down."" (normal word order: ""I cannot put down the book."")",Inversion,Inversion
"Behind the curtain, the wizard stood."" (normal word order: ""The wizard stood behind the curtain."")",Inversion,Inversion
"Away from the party, she walked."" (normal word order: ""She walked away from the party."")",Inversion,Inversion
"On the floor, lay a pile of clothes."" (normal word order: ""A pile of clothes lay on the floor."")",Inversion,Inversion
"Little did she know, she was about to embark on the adventure of a lifetime."" (normal word order: ""She was about to embark on the adventure of a lifetime, little did she know."")",Inversion,Inversion
Strong is the Force.,Inversion,Inversion
Not in the mood am I today.,Inversion,Inversion
Never shall I forget the sight of their faces.,Inversion,Inversion
Front and center stood the king.,Inversion,Inversion
In a hole in the ground there lived a hobbit.,Inversion,Inversion
"Only when you let go, will you truly be free.",Inversion,Inversion
"Up into the air I flew, like a bird escaping its cage.",Inversion,Inversion
"Wide open are the possibilities, if only you have the courage to take a chance.",Inversion,Inversion
Never do I want to see that play again.,Inversion,Inversion
"Into the water jumped the playful dolphin, eager to show off its tricks.",Inversion,Inversion
Never have I seen such a beautiful sunset than on that evening.,Inversion,Inversion
Gone are the days when we had to rely on outdated technology.,Inversion,Inversion
"On top of the mountain, the hikers rested, tired but exhilarated.",Inversion,Inversion
Out of the darkness came a glimmer of hope.,Inversion,Inversion
"Behind the curtain stood the wizard, ready to reveal his magic.",Inversion,Inversion
"Underneath the bed lurked the monster, waiting for its next victim.",Inversion,Inversion
Toward the horizon stretched the seemingly endless desert.,Inversion,Inversion
"Against all odds, she refused to give up on her dreams.",Inversion,Inversion
Never have I been more disappointed.,Inversion,Inversion
Rarely have I seen such a beautiful sunset.,Inversion,Inversion
"Little did she know, her dream was about to come true.",Inversion,Inversion
In the land of the free and the home of the brave.,Inversion,Inversion
"Not only did he lose the game, but also his confidence.",Inversion,Inversion
Only after he left did she realize how much she loved him.,Inversion,Inversion
How quickly the tables can turn in this unpredictable game.,Inversion,Inversion
"Many are called, but few are chosen.",Inversion,Inversion
Seldom have I met someone with such intelligence and grace.,Inversion,Inversion
Not a single word did she speak as she walked out of the room.,Inversion,Inversion
"In my wildest dreams, never did I imagine I'd be here.",Inversion,Inversion
Rarely do we find a person who truly understands us.,Inversion,Inversion
"Such was his intelligence, he could solve any problem in an instant.",Inversion,Inversion
"Only when we let go of fear, do we truly begin to live.",Inversion,Inversion
Not a moment goes by that I don't miss you.,Inversion,Inversion
Never have I tasted a dessert as delicious as this one.,Inversion,Inversion
"Only with hard work and determination, can we achieve greatness.",Inversion,Inversion
"To live a life full of joy and meaning, we must first find peace within ourselves.",Inversion,Inversion
Never have I seen such beauty in all my travels.,Inversion,Inversion
Out of the cradle endlessly rocking.,Inversion,Inversion
Rarely do we remember the small moments that make life worth living.,Inversion,Inversion
"Let us not ask what our country can do for us, but what we can do for our country.",Inversion,Inversion
"In a world full of chaos and uncertainty, we must remember to spread love and kindness.",Inversion,Inversion
No greater gift can one person give than their time and attention.,Inversion,Inversion
Gone are the days when hard work and determination were valued above all else.,Inversion,Inversion
Only through forgiveness and understanding can true healing occur.,Inversion,Inversion
"From the depths of despair, came the strength to move forward and persevere.",Inversion,Inversion
Hard it is to bear the utter loss of words when someone we hold dear has passed away.,Inversion,Inversion
"Little did she know, that her hard work would pay off in the end.",Inversion,Inversion
"Out of the night that covers me, black as the pit from pole to pole, I thank whatever gods may be for my unconquerable soul."" (William Ernest Henley)",Inversion,Inversion
Rarely have I witnessed such bravery and resilience in the face of adversity.,Inversion,Inversion
"Tired and worn, into bed I fell.",Inversion,Inversion
"Not a thought in my head could I form, so shocked was I by the news.",Inversion,Inversion
On the top of the hill stood the old abandoned house.,Inversion,Inversion
"Into the depths of despair did he sink, until he found a glimmer of hope.",Inversion,Inversion
Never have I been more sure of anything in my life.,Inversion,Inversion
"In the midst of chaos, there was peace and stillness.",Inversion,Inversion
Excited for the new job was she.,Inversion,Inversion
Never have I seen such a beautiful landscape.,Inversion,Inversion
"Through the thick fog, the ship sailed.",Inversion,Inversion
"Little did he know, his life was about to change forever.",Inversion,Inversion
"With his head high, the king entered the court.",Inversion,Inversion
"Darkness surrounded her, but she wasn't afraid.",Inversion,Inversion
Not until the end of the world will I stop loving you.,Inversion,Inversion
Rarely have I tasted such delicious food.,Inversion,Inversion
"In the quiet of the night, the child cried for his mother.",Inversion,Inversion
"Checked and double-checked, the documents were flawless.",Inversion,Inversion
"With tears streaming down her face, she sang with joy.",Inversion,Inversion
"Little did he know, the consequence of his actions would lead to his downfall.",Inversion,Inversion
"On a cold winter's night, as the stars twinkled above, she realized her true feelings for him.",Inversion,Inversion
"Out of the darkness appeared a figure so magnificent, it took everyone's breath away.",Inversion,Inversion
"For peace and prosperity, the negotiations must be handled with delicacy and tact.",Inversion,Inversion
Never in a million years did she imagine herself working for such a prestigious company.,Inversion,Inversion
"With only a moment to spare, the hero swooped in and saved the day.",Inversion,Inversion
"Through trial and error, he finally solved the puzzle and unlocked the secret.",Inversion,Inversion
To confess one's sins and ask for forgiveness is the first step towards redemption.,Inversion,Inversion
Broken is the bond of trust.,Inversion,Inversion
From hand to hand a beggar breaks his bread.,Inversion,Inversion
With our minds we create our own reality.,Inversion,Inversion
"In the darkness of the night, creatures come to life.",Inversion,Inversion
"Surrounded by chaos, the leader maintained his composure.",Inversion,Inversion
"Darkness there, and nothing more.",Inversion,Inversion
"In the face of adversity, we can choose to thrive.",Inversion,Inversion
"Echo the past, and now my love is somewhere far away.",Inversion,Inversion
"To err is human, to forgive divine.",Inversion,Inversion
No time I had for rest or reflection.,Inversion,Inversion
Only after the storm had passed did we realize the extent of the damage.,Inversion,Inversion
"From the bottom of my heart, I thank you.",Inversion,Inversion
"So great was his fear, he couldn't move a muscle.",Inversion,Inversion
"Out of the darkness came a light, brighter than any I had ever seen.",Inversion,Inversion
Not until she had left did I realize how much I missed her.,Inversion,Inversion
"In my wildest dreams, I never thought I would achieve such success.",Inversion,Inversion
Nowhere is it written that we must follow in our parents' footsteps.,Inversion,Inversion
"With a curious mind and a passion for adventure, did he explore every hidden corner of the world.",Inversion,Inversion
"Never have I seen such a majestic creature, with its vibrant colors and graceful movements.",Inversion,Inversion
"On a dark and stormy night, did the moon hide behind the clouds.",Inversion,Inversion
"In the dead of winter, do the trees stand bare and cold.",Inversion,Inversion
"Gone are the days of peace and harmony, replaced by chaos and terror.",Inversion,Inversion
"In the midst of chaos, did she find her inner peace.",Inversion,Inversion
"Never before have I tasted such a delectable dish, with its unique blend of spices and flavors.",Inversion,Inversion
"With steady hands and a steady heart, she completed the daunting task.",Inversion,Inversion
"From the ashes of destruction, did she rise stronger and fiercer than ever before.",Inversion,Inversion
"In a world of darkness and despair, does hope still exist.",Inversion,Inversion
Of hasty judgments the worst often are they that are perfectly certain.,Inversion,Inversion
"2. ""In the face of danger, fearless he stood.",Inversion,Inversion
"3. ""United with their loved ones in life, divided by death they now are.",Inversion,Inversion
"4. ""With great power comes great responsibility.",Inversion,Inversion
"5. ""At the bottom of the stairway lay the injured kitten.",Inversion,Inversion
"6. ""Gone are the days when we could relax and enjoy life.",Inversion,Inversion
"7. ""Out of the darkness, a glimmer of hope appeared.",Inversion,Inversion
"8. ""On the top of the mountain, he built his fortress.",Inversion,Inversion
"9. ""In the stillness of the night, she heard a faint cry.",Inversion,Inversion
"10. ""Into the unknown, he bravely ventured.",Inversion,Inversion
"Wrong it was, in the midst of that bright light, to see those primeval brutes, dumb and monstrous, his comrades."" - Heart of Darkness by Joseph Conrad",Inversion,Inversion
"Down, but not out."" - This is an example of inverted word order used in a phrase or slogan.",Inversion,Inversion
"Out of the night that covers me, black as the pit from pole to pole, I thank whatever gods may be for my unconquerable soul."" - Invictus by William Ernest Henley",Inversion,Inversion
"Never have I ever felt such fear."" - This inversion emphasizes the intensity of the speaker's fear.",Inversion,Inversion
"Gone are the days when we would roam freely, but here we are, stuck in this concrete jungle."" - This inversion creates a sense of nostalgia and contrasts it with the current reality.",Inversion,Inversion
"Only in the silence of the night, do I truly understand the weight of my emotions."" - This inversion emphasizes the idea that the speaker's true feelings only come out in the quiet of the night.",Inversion,Inversion
"With this ring, I thee wed."" - This inversion is commonly used in wedding vows.",Inversion,Inversion
"Little did she know, her life was about to change forever."" - This inversion creates suspense and foreshadows a major event.",Inversion,Inversion
"Out of the mouth of babes and sucklings, have I ordained strength."" - The Bible, Psalm 8:2",Inversion,Inversion
"In a hole in the ground there lived a hobbit."" - The Hobbit by J.R.R. Tolkien",Inversion,Inversion
