,sentence,rhetoric
Never have I seen such a beautiful sunset.,Inversion,Inversion
Only through struggle can true strength be found.,Inversion,Inversion
"Little did she know, the greatest adventure of her life was about to begin.",Inversion,Inversion
Rarely have I encountered such a kind and generous soul.,Inversion,Inversion
Not until the sky clears will we begin our journey home.,Inversion,Inversion
Hardly had the celebration ended when tragedy struck.,Inversion,Inversion
"Out the window, the birds flew, their feathers fluttering in the wind.",Inversion,Inversion
Seldom do I find someone who truly understands me.,Inversion,Inversion
No sooner had he left the room than she regretted her harsh words.,Inversion,Inversion
Not until the rain stops will we be able to enjoy the picnic.,Inversion,Inversion
Only with hard work and determination can you achieve your goals.,Inversion,Inversion
Not until the last page will the mystery be solved.,Inversion,Inversion
Little did I know that she was actually the culprit.,Inversion,Inversion
On top of the mountain stood a magnificent castle.,Inversion,Inversion
In the garden bloomed a single white rose.,Inversion,Inversion
Not a single word did he say to defend himself.,Inversion,Inversion
"In the mirror, she saw a reflection of her younger self.",Inversion,Inversion
"Out of the darkness, emerged a figure in a black cloak.",Inversion,Inversion
Never before had I tasted such delicious food.,Inversion,Inversion
"Joy, she found that day, turned out to be fleeting and short-lived.",Inversion,Inversion
Long and winding is the path that leads to true success.,Inversion,Inversion
"In a world dominated by technology, it is we who have become the tools.",Inversion,Inversion
"Into the dark forest, rode the brave knight.",Inversion,Inversion
"Not only did he lose the match, but also the respect of his peers.",Inversion,Inversion
High and mighty are those who hold the power.,Inversion,Inversion
"Out of the chaos, emerged a sense of calm.",Inversion,Inversion
Rarely have I seen someone with such grace and poise.,Inversion,Inversion
"In our greatest moments of despair, we often find our greatest strength.",Inversion,Inversion
"Here and now, we must make a decision that will shape our future.",Inversion,Inversion
1. Never have I seen such a beautiful sunset.,Inversion,Inversion
2. Down the long and winding road we journeyed.,Inversion,Inversion
"3. In the midst of chaos, there is also opportunity.",Inversion,Inversion
"4. Little did she know, her life was about to change forever.",Inversion,Inversion
5. So pure is the water that it reflects the image of the sky.,Inversion,Inversion
6. No longer can we deny the reality of climate change.,Inversion,Inversion
"7. Against all odds, she rose to become the first female CEO.",Inversion,Inversion
8. Rarely does he express his deepest emotions.,Inversion,Inversion
9. Only when we let go of our fears can we truly be free.,Inversion,Inversion
"10. Through thick and thin, they stood by each other's side.",Inversion,Inversion
"Strong was his love for her, though she never knew.",Inversion,Inversion
"Out of the night that covers me, black as the pit from pole to pole.",Inversion,Inversion
"Not a hero is he, but a warrior on the battlefield.",Inversion,Inversion
"Up and down the street, the children played.",Inversion,Inversion
"Far over the misty mountains cold, to dungeons deep and caverns old.",Inversion,Inversion
"Through hardship and struggle, emerges a victorious spirit.",Inversion,Inversion
"Their lives, their fortunes, their sacred honor, they pledged to the fight.",Inversion,Inversion
"Hear, the whispers of the wind, the secrets it holds.",Inversion,Inversion
"For in this time of darkness, hope will be our guiding light.",Inversion,Inversion
"With every step he takes, closer and closer to his destiny he comes.",Inversion,Inversion
No longer can we ignore the consequences of climate change.,Inversion,Inversion
Not until she left did I realize how much I loved her.,Inversion,Inversion
"Little did I know, my life was about to change forever.",Inversion,Inversion
Only after she passed away did I understand the true impact she had on my life.,Inversion,Inversion
Rarely do we see such acts of kindness in today's society.,Inversion,Inversion
In vain did I search for my lost keys.,Inversion,Inversion
"Dark were the clouds, silent was the forest.",Inversion,Inversion
"Not a soul was in sight, nor a sound could be heard.",Inversion,Inversion
Gone are the days when we could roam freely without fear.,Inversion,Inversion
"Beautifully paved the streets were, with colorful flowers lining the sidewalks.",Inversion,Inversion
"Deep in the forest lie ancient ruins, untouched and forgotten.",Inversion,Inversion
"Forgotten was the promise he made, as he walked away from her.",Inversion,Inversion
"Wise and strong, he may be, but a leader he is not.",Inversion,Inversion
"Through the dark and stormy night, they marched courageously.",Inversion,Inversion
"In the city of dreams, reality fades away.",Inversion,Inversion
"Gone with the wind, the memories of our past.",Inversion,Inversion
"The key to happiness, found within oneself it is.",Inversion,Inversion
"Not only did he play the guitar, but also sang beautifully.",Inversion,Inversion
"Hard to believe it may seem, but the truth it is.",Inversion,Inversion
"On the branch sat the playful, colorful birds.",Inversion,Inversion
How wonderful it was to see her smile.,Inversion,Inversion
From the depths of the ocean rose the mighty Kraken.,Inversion,Inversion
"Up the stairs, she ran, eager to reach the top.",Inversion,Inversion
"In the darkness, fear crept into his mind.",Inversion,Inversion
"Never give up,"" the wise old man spoke.",Inversion,Inversion
"From her hands, fell the shattered glass.",Inversion,Inversion
"In the quiet of the night, the only sound was the rustling of leaves.",Inversion,Inversion
"What a beautiful sight it was, to behold the sunset.",Inversion,Inversion
"With his arms wide open, he embraced the new day.",Inversion,Inversion
"Down the dark alleyway he walked, alone and afraid.",Inversion,Inversion
"Behind the clouds, the sun hid from sight.",Inversion,Inversion
Never have I seen such a beautiful sight.,Inversion,Inversion
"In the dead of the night, he crept silently through the house.",Inversion,Inversion
"Up the stairs she ran, eager to reach the top.",Inversion,Inversion
Rarely does one find such loyalty and dedication.,Inversion,Inversion
"Out of the murky waters, rose the ancient creature.",Inversion,Inversion
"Underneath the layers of lies, her true intentions were hidden.",Inversion,Inversion
"Without hesitation, he plunged into the freezing water.",Inversion,Inversion
"Forgotten by society, she found solace in the company of her books.",Inversion,Inversion
"In this world, nothing is certain, but death and taxes.",Inversion,Inversion
"On the shoulders of giants, we stand.",Inversion,Inversion
"Little did I know, she was already planning a surprise party for me.",Inversion,Inversion
"Out of adversity, comes strength.",Inversion,Inversion
"Over the hill and through the woods, to grandmother's house we go.",Inversion,Inversion
Rarely have I felt more alive than I did in that moment.,Inversion,Inversion
"Only when you let go of your fears, can you truly embrace your dreams.",Inversion,Inversion
"Underneath the chaos, there lies a sense of order.",Inversion,Inversion
"No longer were they enemies, but allies fighting for the same cause.",Inversion,Inversion
Great is the power of habit.,Inversion,Inversion
Never have I seen such beauty in nature.,Inversion,Inversion
"The night crept in, silent and dark.",Inversion,Inversion
"Little did I know, it would be my last chance.",Inversion,Inversion
"Out of the darkness, came a glimmer of hope.",Inversion,Inversion
"Not a hand did she raise, nor a word did she speak.",Inversion,Inversion
"In the stillness of the night, a cry could be heard.",Inversion,Inversion
"Better safe than sorry, goes the saying.",Inversion,Inversion
"Hardly had they begun, when the storm arrived.",Inversion,Inversion
Rarely have I been so moved by a speech.,Inversion,Inversion
"In a galaxy far, far away.",Inversion,Inversion
Rarely have I seen such bravery in the face of danger.,Inversion,Inversion
"Beautiful is the night sky, with stars shining bright.",Inversion,Inversion
Never have I felt more alive than in this moment.,Inversion,Inversion
"On the top of the mountain, stood the brave adventurer.",Inversion,Inversion
So fierce were the winds that even the trees bowed down.,Inversion,Inversion
So much have I learned from my mistakes.,Inversion,Inversion
"In the depths of despair, I found my greatest strength.",Inversion,Inversion
Only in silence can one truly hear their inner thoughts.,Inversion,Inversion
Never again do I want to experience such heartache.,Inversion,Inversion
"Weak I am, but brave she is.",Inversion,Inversion
"On the table sat the delicious, warm apple pie.",Inversion,Inversion
Rain came down the whole night.,Inversion,Inversion
Into the darkness she walked.,Inversion,Inversion
Never have I seen such a stunning sunset.,Inversion,Inversion
"In the midst of chaos, there is also opportunity.",Inversion,Inversion
Tall and handsome was the brave knight.,Inversion,Inversion
"Silently he tiptoed, not making a single sound.",Inversion,Inversion
With great power comes great responsibility.,Inversion,Inversion
"Out of the ashes, rose a new era.",Inversion,Inversion
"Hard it is to live, and harder still to find true happiness.",Inversion,Inversion
"Not a creature was stirring, not even a mouse.",Inversion,Inversion
"United we stand, divided we fall.",Inversion,Inversion
Gone were the days of peace and tranquility.,Inversion,Inversion
"In the forest dark and deep, I found my path to enlightenment.",Inversion,Inversion
"Through blood, sweat, and tears, he achieved his dream.",Inversion,Inversion
"With friends like these, who needs enemies?",Inversion,Inversion
"A fool he was not, but wise he was far from.",Inversion,Inversion
"Never have I seen such beauty, nor will I ever again.",Inversion,Inversion
"Peace and quiet, that is all I ask for.",Inversion,Inversion
Never have I felt more alone.,Inversion,Inversion
"Into the abyss he fell, disappearing without a trace.",Inversion,Inversion
"Strong, you are,"" said Yoda.",Inversion,Inversion
Nowhere to be seen was the promised solution.,Inversion,Inversion
"With bated breath, the outcome we waited for.",Inversion,Inversion
"Win, I will,"" declared the determined athlete.",Inversion,Inversion
"Upside down hung the painting, adding a whimsical touch to the room.",Inversion,Inversion
Only in dreams could he find a way out.,Inversion,Inversion
Never before had she seen such a beautiful sight.,Inversion,Inversion
"Here we are, at last,"" sighed the exhausted travelers.",Inversion,Inversion
How strange to see the world from such a different perspective.,Inversion,Inversion
"In the dark of the night, fear was all that remained.",Inversion,Inversion
"Like a ship without a captain, our future is uncertain.",Inversion,Inversion
Never have I seen such a beautiful sunrise.,Inversion,Inversion
"Eye of newt, toe of frog, wool of bat..."" (William Shakespeare, Macbeth)",Inversion,Inversion
"Scared, I was not. Prepared, I was.",Inversion,Inversion
"Twas the night before Christmas, when all through the house.",Inversion,Inversion
"Blind, the man was, but wise, he proved to be.",Inversion,Inversion
"On top of the mountain, the view was breathtaking.",Inversion,Inversion
"Silently, he crept through the dark alleyway.",Inversion,Inversion
"How amazing does the world seem, when viewed from above?",Inversion,Inversion
Rarely have I seen such a beautiful sight.,Inversion,Inversion
"Little did she know, her whole world was about to change.",Inversion,Inversion
Never before have I felt such a sense of accomplishment.,Inversion,Inversion
"No idea do I have, how to solve this problem.",Inversion,Inversion
In no way did she deserve the criticism she received.,Inversion,Inversion
"Only when we let go of our fears, can we truly be free.",Inversion,Inversion
"Not until he lost everything, did he realize what truly mattered.",Inversion,Inversion
"On the mountain sat a great wizard, known to all as powerful and wise.",Inversion,Inversion
"Everywhere I go, I am searching for something, but what that is, I do not know.",Inversion,Inversion
"Into the darkness peered the young girl, as she searched for her lost teddy bear.",Inversion,Inversion
"Through the fog she sailed, deftly navigating her small boat.",Inversion,Inversion
Only after the sun had set did we realize we'd left our food behind.,Inversion,Inversion
Never have I seen such a magnificent sunset as the one over the ocean.,Inversion,Inversion
"In the misty forest stood, all alone, the abandoned cottage.",Inversion,Inversion
"With determination and perseverance, he climbed the steep and treacherous mountain.",Inversion,Inversion
"Out of the storm emerged a lone figure, his hair and clothes drenched from the rain.",Inversion,Inversion
"Up the hill galloped the majestic stallion, his hooves pounding against the ground.",Inversion,Inversion
"At the crack of dawn, the fishermen set sail into the vast and open sea.",Inversion,Inversion
"In the midst of chaos and destruction, there arose a glimmer of hope.",Inversion,Inversion
1. Never have I felt such sadness.,Inversion,Inversion
"2. In the stillness of the night, only the crickets could be heard.",Inversion,Inversion
"3. Little did they know, the true culprit was someone they trusted.",Inversion,Inversion
"4. Man's inhumanity to man, never has it been more evident.",Inversion,Inversion
5. Only after the rain had stopped did the sun emerge from the clouds.,Inversion,Inversion
"6. With her beauty, she never failed to capture everyone's attention.",Inversion,Inversion
"7. In the land of the blind, the one-eyed man is king.",Inversion,Inversion
8. Only by working together can we overcome this challenge.,Inversion,Inversion
9. Rarely have I seen such courage in the face of adversity.,Inversion,Inversion
10. Never before had I tasted such a delectable dish.,Inversion,Inversion
"With his wealth, his power grew.",Inversion,Inversion
"Ye cats of Greece, arise!",Inversion,Inversion
Out flew the web and floated wide;,Inversion,Inversion
mirror crack’d from side to side.,Inversion,Inversion
"In my heart, I know the truth.",Inversion,Inversion
"Into the darkness, she dove.",Inversion,Inversion
"By day, he worked; by night, he dreamed.",Inversion,Inversion
"On the mountaintop, she shouted for joy.",Inversion,Inversion
"Behind the clouds, the sun still shines.",Inversion,Inversion
The storm came with fury.,Inversion,Inversion
"In the depths of despair, she found hope.",Inversion,Inversion
"His words, not his actions, were what made the most impact on the audience.",Inversion,Inversion
Into the darkness crept a slinking figure.,Inversion,Inversion
"In the valley, heard the rivers flow.",Inversion,Inversion
"Tired, we were, after a long day of hiking.",Inversion,Inversion
"In the face of danger, he remained calm and collected.",Inversion,Inversion
"Roasted, with a sprinkle of salt, is how she liked her potatoes.",Inversion,Inversion
"Gone are the days of peaceful living, now replaced by constant chaos.",Inversion,Inversion
Never have I seen such a beautiful sunset as tonight.,Inversion,Inversion
"Out of the ashes, rose a new hope for the town.",Inversion,Inversion
"In the midst of chaos, emerged a leader.",Inversion,Inversion
"Fear leads to anger. Anger leads to hate. Hate leads to suffering."" - Yoda",Inversion,Inversion
"How strange it is to be anything at all."" - Neutral Milk Hotel",Inversion,Inversion
"Gone are the days of joy and laughter, now only darkness and despair remain.",Inversion,Inversion
"Not with defeat, but with fresh strength of soul."" - Sri Aurobindo",Inversion,Inversion
"Never was so much owed by so many to so few."" - Winston Churchill",Inversion,Inversion
"So vast the wave, so broad the stillness"" - Johann Wolfgang von Goethe",Inversion,Inversion
"Only in sleep are men free."" - John Steinbeck",Inversion,Inversion
"In this war, that war no end--and the Hebrews march with banner, shield, and horn."" - Walt Whitman",Inversion,Inversion
Rarely have we seen such courage and determination in the face of adversity.,Inversion,Inversion
"As the saying goes, a hungry man is an angry man.",Inversion,Inversion
"Into the abyss, she fell.",Inversion,Inversion
"Gently, the wind whispered through the trees.",Inversion,Inversion
"Ask not what your country can do for you, but what you can do for your country.",Inversion,Inversion
"With tears in her eyes, she said goodbye.",Inversion,Inversion
"Faster and faster, the car sped down the highway.",Inversion,Inversion
"On top of the mountain, he stood, triumphant.",Inversion,Inversion
"An apple a day, keeps the doctor away.",Inversion,Inversion
"Out of the darkness, came a shining light.",Inversion,Inversion
"In the deep ocean, lies a treasure beyond compare.",Inversion,Inversion
Barely able to contain his excitement was John at the thought of the upcoming trip.,Inversion,Inversion
"On the floor lay the wounded soldier, his groans echoing through the deserted streets.",Inversion,Inversion
"In times of great difficulty, do or die we must.",Inversion,Inversion
Seldom does one have the opportunity to witness such a magnificent sunrise over the mountains.,Inversion,Inversion
"Rather than upset his parents, Jack lied about where he had gone last night.",Inversion,Inversion
"Up the stairs and down the hallway ran the frightened child, seeking refuge from the thunderstorm.",Inversion,Inversion
Never have I seen such a display of courage and selflessness as I did on that battlefield.,Inversion,Inversion
"Deep in the forest lurked a creature, its glowing eyes piercing through the darkness.",Inversion,Inversion
"Only after the storm had passed did the birds begin to sing again, their songs a sign of hope.",Inversion,Inversion
"Across the river the bridge stretched, connecting the two sides of the bustling city.",Inversion,Inversion
"Strong in the Force, young Skywalker is.",Inversion,Inversion
"Out on the fields, the butterflies danced.",Inversion,Inversion
Never have I ever felt so alive.,Inversion,Inversion
Only when the tide goes out do you discover who's been swimming naked.,Inversion,Inversion
"Over the hill and into the woods, we journeyed.",Inversion,Inversion
Lost in a sea of doubt was she.,Inversion,Inversion
"Against all odds, he succeeded.",Inversion,Inversion
Dark and stormy was the night.,Inversion,Inversion
Not in my backyard will I allow pollution to run rampant.,Inversion,Inversion
Never have I felt so alone. (Normal order: I have never felt so alone.),Inversion,Inversion
"Into the night, the soldiers marched. (Normal order: The soldiers marched into the night.)",Inversion,Inversion
"With fear, came courage. (Normal order: Courage came with fear.)",Inversion,Inversion
"United we stand, divided we fall."" (Normal order: We stand united, we fall divided.)",Inversion,Inversion
"Out of the window, the cat leaped. (Normal order: The cat leaped out of the window.)",Inversion,Inversion
"Little did I know, the answer was right in front of me. (Normal order: The answer was right in front of me, little did I know.)",Inversion,Inversion
"Fly, you did not, on your own wings."" (Normal order: You did not fly on your own wings.)",Inversion,Inversion
"Behind the curtain, the truth was concealed. (Normal order: The truth was concealed behind the curtain.)",Inversion,Inversion
"Only when we admit our mistakes, can we truly learn from them. (Normal order: We can truly learn from our mistakes only when we admit them.)",Inversion,Inversion
"In my heart, I knew it was wrong. (Normal order: I knew it was wrong in my heart.)",Inversion,Inversion
Hard it is to imagine a world without music.,Inversion,Inversion
"Into the night she rode, fearless and free.",Inversion,Inversion
Behind the curtain lies a world of mystery.,Inversion,Inversion
Not a word did he say to defend himself.,Inversion,Inversion
Never before had she seen such a sight.,Inversion,Inversion
"Without passion, there is no art.",Inversion,Inversion
Humble am I to have such great friends.,Inversion,Inversion
On the edge of the cliff stood the brave soldier.,Inversion,Inversion
Only when we embrace our differences can we truly unite as one.,Inversion,Inversion
"In the garden, bloomed a single rose.",Inversion,Inversion
"Down the river, sailed the boat.",Inversion,Inversion
"Underneath the tree, sat the cat.",Inversion,Inversion
"On the beach, walked the happy couple.",Inversion,Inversion
"Away from the chaos, ran the child.",Inversion,Inversion
"Behind the curtain, hid the surprise.",Inversion,Inversion
"With determination, fought the brave soldier.",Inversion,Inversion
"Amidst the chaos, emerged a leader.",Inversion,Inversion
"Revere the dead, celebrate the living.",Inversion,Inversion
From the chaos emerged order.,Inversion,Inversion
"Honesty is the best policy, so they say.",Inversion,Inversion
"Underneath the stars, we danced.",Inversion,Inversion
"Lost I feel, without your love.",Inversion,Inversion
"The rain came down, with a vengeance.",Inversion,Inversion
"Forrest Gump, a movie classic.",Inversion,Inversion
"To have a friend, first be a friend.",Inversion,Inversion
"Out of the darkness, emerged the light.",Inversion,Inversion
"A blessing in disguise, was my failure.",Inversion,Inversion
"From this day forward, I shall wear the crown of victory.",Inversion,Inversion
"Not only did he fail to win the game, but he also lost his sense of pride.",Inversion,Inversion
"On the top of the hill stood the great castle, beckoning us forward.",Inversion,Inversion
"With tears in my eyes, I bade my loved ones farewell.",Inversion,Inversion
Never have I heard such beautiful music.,Inversion,Inversion
"So fierce was the lion, that even the bravest of men trembled.",Inversion,Inversion
"No sooner had the sun set, than the stars appeared in the sky.",Inversion,Inversion
Rarely do we see such acts of kindness in this world.,Inversion,Inversion
"With his head hung low, he walked away in defeat.",Inversion,Inversion
"With this ring, I thee wed.",Inversion,Inversion
Out of adversity comes opportunity.,Inversion,Inversion
"Had I known the truth, I would have acted differently.",Inversion,Inversion
Great is the power of love.,Inversion,Inversion
Only by forgetting ourselves can we truly understand others.,Inversion,Inversion
Rarely do I get this worked up over something.,Inversion,Inversion
Forgotten is the art of letter writing.,Inversion,Inversion
"In his arms, I find solace.",Inversion,Inversion
Not until the darkness falls do we appreciate the light.,Inversion,Inversion
"1. ""Lost in thought, she wandered the streets."" - Inverted word order for emphasis on being lost in thought",Inversion,Inversion
"2. ""Never have I seen such a magnificent sunset."" - Inverted word order for emphasis on the speaker's disbelief",Inversion,Inversion
"3. ""Only when we accept our limitations can we achieve true greatness."" - Inverted word order for emphasis on the key idea of accepting limitations",Inversion,Inversion
"4. ""Out of the dark, misty forest emerged a figure."" - Inverted word order for emphasis on the mysterious appearance of the figure",Inversion,Inversion
"5. ""With tears in her eyes, she said goodbye."" - Inverted word order for emphasis on the emotional state of the speaker",Inversion,Inversion
"6. ""Rarely do we get a second chance."" - Inverted word order for emphasis on the rarity of a second chance",Inversion,Inversion
"7. ""Over the bridge, the river flowed peacefully."" - Inverted word order for emphasis on the location of the peaceful river",Inversion,Inversion
"8. ""Silently, he slipped out of the room."" - Inverted word order for emphasis on the quiet and sneaky departure of the person",Inversion,Inversion
"9. ""From the ashes, a new city rose."" - Inverted word order for emphasis on the rebirth of a city after destruction",Inversion,Inversion
"10. ""Only when the truth is uncovered can justice prevail."" - Inverted word order for emphasis on the importance of uncovering the truth for justice.",Inversion,Inversion
"In the dead of night, the eerie silence lay heavy over the city.",Inversion,Inversion
"Little did she know, her life was about to change forever.",Inversion,Inversion
Not until the storm had passed did they emerge from their shelter.,Inversion,Inversion
Never have I tasted such a delicious meal.,Inversion,Inversion
Only when you lose everything do you realize what truly matters.,Inversion,Inversion
On the edge of the cliff stood the fearless adventurer.,Inversion,Inversion
Seldom do I find peace in the chaos of the city.,Inversion,Inversion
No longer could she ignore the truth that had been staring her in the face.,Inversion,Inversion
"In the chaos of battle, the soldiers fought with unwavering determination.",Inversion,Inversion
Inside the box was a hidden treasure.,Inversion,Inversion
Rarely does she ever take a day off.,Inversion,Inversion
"Little did I know, the answer was right in front of me.",Inversion,Inversion
Up in flames went the entire house.,Inversion,Inversion
"In the heart of the city, do you find peace?",Inversion,Inversion
Hardly can she contain her excitement.,Inversion,Inversion
"At the end of the tunnel, lies the light.",Inversion,Inversion
"With tears in her eyes, did she finally find closure.",Inversion,Inversion
"Beneath the surface of the water, lies a world unseen.",Inversion,Inversion
"Doubtful it stood, as two spent swimmers that do cling together and choke their art."" - Shakespeare",Inversion,Inversion
Up the stream of time we gaze back to our beginnings.,Inversion,Inversion
Happily ever after lived the prince and princess.,Inversion,Inversion
"Little did she know, her entire life was about to change.",Inversion,Inversion
