,sentence,rhetoric
All mammals have fur.,Syllogism,Syllogism
Elephants are mammals.,Syllogism,Syllogism
"Therefore, elephants have fur.",Syllogism,Syllogism
"If I study hard, I will pass the exam.",Syllogism,Syllogism
I studied hard.,Syllogism,Syllogism
"Therefore, I will pass the exam.",Syllogism,Syllogism
"If someone is guilty, they will have a motive.",Syllogism,Syllogism
The defendant had a clear motive.,Syllogism,Syllogism
"Therefore, the defendant is guilty.",Syllogism,Syllogism
All vegetables are healthy.,Syllogism,Syllogism
Broccoli is a vegetable.,Syllogism,Syllogism
"Therefore, broccoli is healthy.",Syllogism,Syllogism
"If it's raining, the roads will be wet.",Syllogism,Syllogism
The roads are wet.,Syllogism,Syllogism
"Therefore, it must be raining.",Syllogism,Syllogism
All dogs are animals.,Syllogism,Syllogism
Turtles are not dogs.,Syllogism,Syllogism
"Therefore, turtles are not animals.",Syllogism,Syllogism
"If the defendant is telling the truth, witness testimonies will align.",Syllogism,Syllogism
Witness testimonies align.,Syllogism,Syllogism
"Therefore, the defendant is telling the truth.",Syllogism,Syllogism
All triangles have three sides.,Syllogism,Syllogism
This shape has three sides.,Syllogism,Syllogism
"Therefore, this shape is a triangle.",Syllogism,Syllogism
"If a car has four wheels, it is a vehicle.",Syllogism,Syllogism
This car has four wheels.,Syllogism,Syllogism
"Therefore, this car is a vehicle.",Syllogism,Syllogism
"If the food is spicy, it will make me sweat.",Syllogism,Syllogism
This food is making me sweat.,Syllogism,Syllogism
"Therefore, this food is spicy.",Syllogism,Syllogism
All humans are mortal.,Syllogism,Syllogism
animals are humans.,Syllogism,Syllogism
some animals are mortal.,Syllogism,Syllogism
"If Peter is taller than John,",Syllogism,Syllogism
"John is taller than Mark,",Syllogism,Syllogism
Peter is taller than Mark.,Syllogism,Syllogism
"If it's raining outside,",Syllogism,Syllogism
the streets will be wet.,Syllogism,Syllogism
streets are wet.,Syllogism,Syllogism
it must be raining outside.,Syllogism,Syllogism
are mammals.,Syllogism,Syllogism
dogs have fur.,Syllogism,Syllogism
"If it is cloudy,",Syllogism,Syllogism
it will most likely rain.,Syllogism,Syllogism
is cloudy.,Syllogism,Syllogism
All students love sleeping.,Syllogism,Syllogism
is a student.,Syllogism,Syllogism
Sally loves sleeping.,Syllogism,Syllogism
"If you want to lose weight,",Syllogism,Syllogism
have to exercise regularly.,Syllogism,Syllogism
exercises regularly.,Syllogism,Syllogism
Jane wants to lose weight.,Syllogism,Syllogism
All politicians make promises.,Syllogism,Syllogism
Trump is a politician.,Syllogism,Syllogism
Donald Trump makes promises.,Syllogism,Syllogism
Roses are red.,Syllogism,Syllogism
are blue.,Syllogism,Syllogism
roses are not violets.,Syllogism,Syllogism
All athletes are physically fit.,Syllogism,Syllogism
James is an athlete.,Syllogism,Syllogism
LeBron James is physically fit.,Syllogism,Syllogism
dogs are mammals.,Syllogism,Syllogism
some dogs have fur.,Syllogism,Syllogism
shape has three sides.,Syllogism,Syllogism
this shape is a triangle.,Syllogism,Syllogism
"If someone steals, they are a criminal.",Syllogism,Syllogism
stole from the store.,Syllogism,Syllogism
John is a criminal.,Syllogism,Syllogism
All birds have wings.,Syllogism,Syllogism
penguin is a bird.,Syllogism,Syllogism
a penguin has wings.,Syllogism,Syllogism
"If it is raining, the ground is wet.",Syllogism,Syllogism
ground is wet.,Syllogism,Syllogism
it is raining.,Syllogism,Syllogism
All students attend school.,Syllogism,Syllogism
John attends school.,Syllogism,Syllogism
"If a shape has four sides, it is a square.",Syllogism,Syllogism
shape has four sides.,Syllogism,Syllogism
this shape is a square.,Syllogism,Syllogism
All apples are fruits.,Syllogism,Syllogism
is an apple.,Syllogism,Syllogism
this is a fruit.,Syllogism,Syllogism
"If someone is a parent, they have a child.",Syllogism,Syllogism
is a parent.,Syllogism,Syllogism
Mary has a child.,Syllogism,Syllogism
"If a car is electric, it does not need gas.",Syllogism,Syllogism
car is electric.,Syllogism,Syllogism
this car does not need gas.,Syllogism,Syllogism
"All mammals have hair. Elephants are mammals. Therefore, elephants have hair.",Syllogism,Syllogism
"If all bakers wear aprons, and Max is a baker, then it follows that Max wears an apron.",Syllogism,Syllogism
"Every library has books. The bookstore down the street has books. Therefore, the bookstore down the street is a library.",Syllogism,Syllogism
"Nothing that is alive can be in two places at once. Flowers are alive. Hence, flowers cannot be in two places at once.",Syllogism,Syllogism
"If time travel were possible, we’d already have visitors from the future. But we don’t have visitors from the future, thus time travel is not possible.",Syllogism,Syllogism
"If you’re a teenager, you have braces. Jill is a teenager. Therefore, Jill has braces.",Syllogism,Syllogism
"All birds have feathers. The penguin is a bird. Therefore, the penguin has feathers.",Syllogism,Syllogism
"If John is late for work, he will get fired. John is late for work. Therefore, John will get fired.",Syllogism,Syllogism
"If I am happy, I will laugh. I am laughing. Hence, I am happy.",Syllogism,Syllogism
"All countries located on the equator are hot. Ecuador is located on the equator. Therefore, Ecuador is hot.",Syllogism,Syllogism
"1. All humans are mortal, Socrates is human, therefore Socrates is mortal.",Syllogism,Syllogism
"If it is sunny outside, then Jane will go to the park. It is sunny outside, thus Jane will go to the park.",Syllogism,Syllogism
"If I don't study, I will fail the test. I didn't study, so I failed the test.",Syllogism,Syllogism
"Birds have feathers, penguins are birds, therefore penguins have feathers.",Syllogism,Syllogism
"All diamonds are valuable, this ring has diamonds, thus this ring is valuable.",Syllogism,Syllogism
"If all dogs have fur, and Fluffy is a dog, then Fluffy has fur.",Syllogism,Syllogism
"If it's raining, then the ground will be wet. It's raining, therefore the ground is wet.",Syllogism,Syllogism
"All physics majors are good at math, John is a physics major, so John is good at math.",Syllogism,Syllogism
"If you exercise regularly, you will be healthy. Sarah exercises regularly, therefore she is healthy.",Syllogism,Syllogism
"All mammals have lungs, whales are mammals, therefore whales have lungs.",Syllogism,Syllogism
"All humans are mortal, and Socrates is a human. Therefore, Socrates is mortal.",Syllogism,Syllogism
"If all birds have feathers, and a penguin is a bird, then a penguin has feathers.",Syllogism,Syllogism
"All performances have actors, and this is a performance. Therefore, this has actors.",Syllogism,Syllogism
"If cats are mammals, and all mammals have fur, then cats have fur.",Syllogism,Syllogism
"All students who study hard get good grades, and Sarah studies hard. Therefore, Sarah will get good grades.",Syllogism,Syllogism
"If all fruits are healthy, and apples are a fruit, then apples are healthy.",Syllogism,Syllogism
"All successful people have determination, and John is a successful person. Therefore, John must have determination.",Syllogism,Syllogism
"If all triangles have three sides, and this shape is a triangle, then this shape has three sides.",Syllogism,Syllogism
"All forms of exercise improve health, and swimming is a form of exercise. Therefore, swimming improves health.",Syllogism,Syllogism
"If all dogs are loyal, and my pet is a dog, then my pet is loyal.",Syllogism,Syllogism
penguins have fur.,Syllogism,Syllogism
All teachers are human.,Syllogism,Syllogism
Smith is a teacher.,Syllogism,Syllogism
Mrs. Smith is human.,Syllogism,Syllogism
"If someone is an Olympic athlete, they are a skilled athlete.",Syllogism,Syllogism
Biles is an Olympic athlete.,Syllogism,Syllogism
Simone Biles is a skilled athlete.,Syllogism,Syllogism
"If it is raining outside, the streets will be wet.",Syllogism,Syllogism
it is raining outside.,Syllogism,Syllogism
All roses have thorns.,Syllogism,Syllogism
flower is a rose.,Syllogism,Syllogism
this flower has thorns.,Syllogism,Syllogism
"If a triangle has three congruent sides, it is an equilateral triangle.",Syllogism,Syllogism
triangle has three congruent sides.,Syllogism,Syllogism
this triangle is an equilateral triangle.,Syllogism,Syllogism
"If a student studies regularly, they will do well on the test.",Syllogism,Syllogism
studies regularly.,Syllogism,Syllogism
Sara will do well on the test.,Syllogism,Syllogism
All reptiles are cold-blooded.,Syllogism,Syllogism
are reptiles.,Syllogism,Syllogism
turtles are cold-blooded.,Syllogism,Syllogism
"If someone is a twin, they have a sibling who was born at the same time.",Syllogism,Syllogism
is a twin.,Syllogism,Syllogism
John has a sibling who was born at the same time.,Syllogism,Syllogism
"If I eat breakfast, I will have enough energy for the day.",Syllogism,Syllogism
ate breakfast this morning.,Syllogism,Syllogism
I have enough energy for the day.,Syllogism,Syllogism
elephants have fur.,Syllogism,Syllogism
No cats can swim.,Syllogism,Syllogism
is a cat.,Syllogism,Syllogism
Fluffy cannot swim.,Syllogism,Syllogism
All fruits are healthy.,Syllogism,Syllogism
are fruits.,Syllogism,Syllogism
apples are healthy.,Syllogism,Syllogism
All plants need sunlight to grow.,Syllogism,Syllogism
are plants.,Syllogism,Syllogism
cacti need sunlight to grow.,Syllogism,Syllogism
All birds have feathers.,Syllogism,Syllogism
are birds.,Syllogism,Syllogism
penguins have feathers.,Syllogism,Syllogism
No reptiles lay eggs.,Syllogism,Syllogism
snakes do not lay eggs.,Syllogism,Syllogism
Only superheroes have superpowers.,Syllogism,Syllogism
is a superhero.,Syllogism,Syllogism
Spiderman has superpowers.,Syllogism,Syllogism
All coffee contains caffeine.,Syllogism,Syllogism
drink is coffee.,Syllogism,Syllogism
this drink contains caffeine.,Syllogism,Syllogism
People born in December are Sagittarius.,Syllogism,Syllogism
was born in December.,Syllogism,Syllogism
Lisa is a Sagittarius.,Syllogism,Syllogism
Dalmatians are mammals.,Syllogism,Syllogism
"Therefore, Dalmatians have fur.",Syllogism,Syllogism
Every plant needs sunlight to grow.,Syllogism,Syllogism
Cacti are plants.,Syllogism,Syllogism
"Thus, cacti need sunlight to grow.",Syllogism,Syllogism
All bunnies are herbivores.,Syllogism,Syllogism
Thumper is a bunny.,Syllogism,Syllogism
"Hence, Thumper is an herbivore.",Syllogism,Syllogism
LeBron James is an athlete.,Syllogism,Syllogism
"Therefore, LeBron James is physically fit.",Syllogism,Syllogism
"If it is raining, the streets will be wet.",Syllogism,Syllogism
The streets are wet.,Syllogism,Syllogism
"Therefore, it must have been raining.",Syllogism,Syllogism
Victor is a bird.,Syllogism,Syllogism
"Therefore, Victor has feathers.",Syllogism,Syllogism
"If you eat too much, you will get sick.",Syllogism,Syllogism
Tom ate too much.,Syllogism,Syllogism
"Hence, Tom will get sick.",Syllogism,Syllogism
Every rose has thorns.,Syllogism,Syllogism
This flower is a rose.,Syllogism,Syllogism
"Thus, this flower has thorns.",Syllogism,Syllogism
All teachers are educated.,Syllogism,Syllogism
Ms. Jenkins is a teacher.,Syllogism,Syllogism
"Therefore, Ms. Jenkins is educated.",Syllogism,Syllogism
"If you study hard, you will get a good grade.",Syllogism,Syllogism
Jane studied hard.,Syllogism,Syllogism
"Hence, Jane got a good grade.",Syllogism,Syllogism
All human beings are mortal.,Syllogism,Syllogism
is a human being.,Syllogism,Syllogism
Socrates is mortal.,Syllogism,Syllogism
snake is a reptile.,Syllogism,Syllogism
a snake is cold-blooded.,Syllogism,Syllogism
"If all dogs chase cats,",Syllogism,Syllogism
"Fido is a dog,",Syllogism,Syllogism
Fido chases cats.,Syllogism,Syllogism
"If it is raining,",Syllogism,Syllogism
ground will be wet.,Syllogism,Syllogism
it must be raining.,Syllogism,Syllogism
"If the moon is made of cheese,",Syllogism,Syllogism
it is edible.,Syllogism,Syllogism
moon is made of cheese.,Syllogism,Syllogism
All politicians lie.,Syllogism,Syllogism
Clinton is a politician.,Syllogism,Syllogism
Hillary Clinton lies.,Syllogism,Syllogism
"If it is a mammal,",Syllogism,Syllogism
has hair.,Syllogism,Syllogism
human is a mammal.,Syllogism,Syllogism
a human has hair.,Syllogism,Syllogism
"If A equals B,",Syllogism,Syllogism
"C is equal to A,",Syllogism,Syllogism
C is equal to B.,Syllogism,Syllogism
All insects have six legs.,Syllogism,Syllogism
spider is not an insect.,Syllogism,Syllogism
a spider does not have six legs.,Syllogism,Syllogism
All mammals have hair.,Syllogism,Syllogism
whales have hair.,Syllogism,Syllogism
All artists are creative.,Syllogism,Syllogism
Van Gogh was an artist.,Syllogism,Syllogism
Vincent Van Gogh was creative.,Syllogism,Syllogism
have feathers.,Syllogism,Syllogism
penguins are birds.,Syllogism,Syllogism
All flowers need sunlight to survive.,Syllogism,Syllogism
are flowers.,Syllogism,Syllogism
roses need sunlight to survive.,Syllogism,Syllogism
"If someone is lactose intolerant, they cannot consume dairy products.",Syllogism,Syllogism
is lactose intolerant.,Syllogism,Syllogism
Samantha cannot consume dairy products.,Syllogism,Syllogism
"If you are a good student, you study regularly.",Syllogism,Syllogism
is a good student.,Syllogism,Syllogism
Alice studies regularly.,Syllogism,Syllogism
"If it rains, the streets are wet.",Syllogism,Syllogism
is raining outside.,Syllogism,Syllogism
the streets are wet.,Syllogism,Syllogism
All basketball players are tall.,Syllogism,Syllogism
Bryant was a basketball player.,Syllogism,Syllogism
Kobe Bryant was tall.,Syllogism,Syllogism
"If it is cold outside, then it must be winter.",Syllogism,Syllogism
is winter.,Syllogism,Syllogism
it must be cold outside.,Syllogism,Syllogism
is a dog.,Syllogism,Syllogism
Fido is an animal.,Syllogism,Syllogism
All men are mortal.,Syllogism,Syllogism
Socrates is a man.,Syllogism,Syllogism
"Therefore, Socrates is mortal.",Syllogism,Syllogism
"If Mother Nature is upset,",Syllogism,Syllogism
then there will be a natural disaster.,Syllogism,Syllogism
"Hurricane Katrina hit,",Syllogism,Syllogism
so Mother Nature must have been upset.,Syllogism,Syllogism
"If you love someone,",Syllogism,Syllogism
you will always support them.,Syllogism,Syllogism
"Sara loves her husband,",Syllogism,Syllogism
"therefore, she will always support him.",Syllogism,Syllogism
The early bird catches the worm.,Syllogism,Syllogism
I always wake up early.,Syllogism,Syllogism
"Therefore, I always catch the worm.",Syllogism,Syllogism
Every student who studies hard,Syllogism,Syllogism
will get good grades.,Syllogism,Syllogism
"John studies hard,",Syllogism,Syllogism
so he will get good grades.,Syllogism,Syllogism
All successful businesses use marketing strategies.,Syllogism,Syllogism
Apple is a successful business.,Syllogism,Syllogism
"Therefore, Apple must use marketing strategies.",Syllogism,Syllogism
then I will bring an umbrella.,Syllogism,Syllogism
"It's raining outside,",Syllogism,Syllogism
so I should bring an umbrella.,Syllogism,Syllogism
"If all dogs are animals,",Syllogism,Syllogism
"and Max is a dog,",Syllogism,Syllogism
then Max must be an animal.,Syllogism,Syllogism
All athletes are dedicated to their sport.,Syllogism,Syllogism
Michael Jordan is an athlete.,Syllogism,Syllogism
"Therefore, Michael Jordan is dedicated to his sport.",Syllogism,Syllogism
"If I practice guitar every day,",Syllogism,Syllogism
I will become a skilled guitarist.,Syllogism,Syllogism
"I practice guitar every day,",Syllogism,Syllogism
"therefore, I will become a skilled guitarist.",Syllogism,Syllogism
"If it rains, the ground is wet.",Syllogism,Syllogism
It is raining.,Syllogism,Syllogism
"Therefore, the ground is wet.",Syllogism,Syllogism
,Syllogism,Syllogism
No mammals lay eggs.,Syllogism,Syllogism
A platypus is a mammal.,Syllogism,Syllogism
"Therefore, a platypus does not lay eggs.",Syllogism,Syllogism
All trees have roots.,Syllogism,Syllogism
The oak tree is a tree.,Syllogism,Syllogism
"Therefore, the oak tree has roots.",Syllogism,Syllogism
Every bird has wings.,Syllogism,Syllogism
A penguin is a bird.,Syllogism,Syllogism
"Therefore, a penguin has wings.",Syllogism,Syllogism
"If it is a triangle, it has three sides.",Syllogism,Syllogism
All love requires trust.,Syllogism,Syllogism
A friendship is based on trust.,Syllogism,Syllogism
"Therefore, a friendship involves love.",Syllogism,Syllogism
"If a dog barks, it must be awake.",Syllogism,Syllogism
The dog is asleep.,Syllogism,Syllogism
"Therefore, the dog is not barking.",Syllogism,Syllogism
"Therefore, this flower has thorns.",Syllogism,Syllogism
"If it is a mammal, it gives birth to live young.",Syllogism,Syllogism
The cat is a mammal.,Syllogism,Syllogism
"Therefore, the cat gives birth to live young.",Syllogism,Syllogism
1. All humans are mortal.,Syllogism,Syllogism
Socrates is a human.,Syllogism,Syllogism
2. All mammals have hair.,Syllogism,Syllogism
Dogs are mammals.,Syllogism,Syllogism
"Therefore, dogs have hair.",Syllogism,Syllogism
"3. If a person is tall, they will play basketball.",Syllogism,Syllogism
John is tall.,Syllogism,Syllogism
"Therefore, John plays basketball.",Syllogism,Syllogism
4. Nothing is better than eternal happiness.,Syllogism,Syllogism
A good night's sleep is better than nothing.,Syllogism,Syllogism
"Therefore, a good night's sleep is better than eternal happiness.",Syllogism,Syllogism
5. All students must pass their final exams to graduate.,Syllogism,Syllogism
Mary is a student.,Syllogism,Syllogism
"Therefore, Mary must pass her final exams to graduate.",Syllogism,Syllogism
"6. If it is raining, the ground will be wet.",Syllogism,Syllogism
The ground is wet.,Syllogism,Syllogism
"Therefore, it is raining.",Syllogism,Syllogism
7. All vegetables are healthy.,Syllogism,Syllogism
Carrots are vegetables.,Syllogism,Syllogism
"Therefore, carrots are healthy.",Syllogism,Syllogism
"8. If we have dedicated practice, we will win the game.",Syllogism,Syllogism
We have dedicated practice.,Syllogism,Syllogism
"Therefore, we will win the game.",Syllogism,Syllogism
9. All birds have feathers.,Syllogism,Syllogism
Penguins are birds.,Syllogism,Syllogism
"Therefore, penguins have feathers.",Syllogism,Syllogism
"10. If an animal is a mammal, it gives birth to live young.",Syllogism,Syllogism
"Therefore, dogs give birth to live young.",Syllogism,Syllogism
"All dogs are animals. Golden retrievers are dogs. Therefore, golden retrievers are animals.",Syllogism,Syllogism
"If all mammals have hair, and a cat is a mammal, then a cat has hair.",Syllogism,Syllogism
"If all carnivores eat meat, and a lion is a carnivore, then a lion eats meat.",Syllogism,Syllogism
"If humans are mammals, and all mammals have spines, then humans have spines.",Syllogism,Syllogism
"If all cars need fuel to run, and a Tesla is a car, then a Tesla needs fuel to run.",Syllogism,Syllogism
"All triangles have three sides. This figure has three sides. Therefore, this figure is a triangle.",Syllogism,Syllogism
"If eating unhealthy foods leads to weight gain, and potato chips are unhealthy, then eating potato chips leads to weight gain.",Syllogism,Syllogism
"If all swans are white, and this bird is a swan, then this bird is white.",Syllogism,Syllogism
"If the Earth is round, and all round objects have a circumference, then the Earth has a circumference.",Syllogism,Syllogism
"If kindness brings happiness, and humans are capable of being kind, then humans are capable of being happy.",Syllogism,Syllogism
is human.,Syllogism,Syllogism
All jazz musicians are creative.,Syllogism,Syllogism
Coltrane is a jazz musician.,Syllogism,Syllogism
John Coltrane is creative.,Syllogism,Syllogism
a penguin has feathers.,Syllogism,Syllogism
dog is a mammal.,Syllogism,Syllogism
a dog gives birth to live young.,Syllogism,Syllogism
Williams is an athlete.,Syllogism,Syllogism
Serena Williams is physically fit.,Syllogism,Syllogism
"If someone owns a car, they have a driver's license.",Syllogism,Syllogism
owns a car.,Syllogism,Syllogism
John has a driver's license.,Syllogism,Syllogism
All planets in our solar system orbit around the sun.,Syllogism,Syllogism
is a planet in our solar system.,Syllogism,Syllogism
Earth orbits around the sun.,Syllogism,Syllogism
"If it is a mammal, it has mammary glands.",Syllogism,Syllogism
cow is a mammal.,Syllogism,Syllogism
a cow has mammary glands.,Syllogism,Syllogism
All classical paintings are stunning.,Syllogism,Syllogism
Mona Lisa is a classical painting.,Syllogism,Syllogism
the Mona Lisa is stunning.,Syllogism,Syllogism
A sparrow is a bird.,Syllogism,Syllogism
"Therefore, a sparrow has wings.",Syllogism,Syllogism
"If it rains, the ground will be wet.",Syllogism,Syllogism
"Therefore, it must have rained.",Syllogism,Syllogism
All soldiers are trained in combat.,Syllogism,Syllogism
Jane is a soldier.,Syllogism,Syllogism
"Therefore, Jane is trained in combat.",Syllogism,Syllogism
"If the store is closed, I cannot buy groceries.",Syllogism,Syllogism
The store is closed.,Syllogism,Syllogism
"Therefore, I cannot buy groceries.",Syllogism,Syllogism
A whale is a mammal.,Syllogism,Syllogism
"Therefore, a whale has hair.",Syllogism,Syllogism
"If it is a weekday, I have to go to work.",Syllogism,Syllogism
Today is a weekday.,Syllogism,Syllogism
"Therefore, I have to go to work.",Syllogism,Syllogism
All vegetables are healthy for you.,Syllogism,Syllogism
"Therefore, broccoli is healthy for you.",Syllogism,Syllogism
"If you study, you will get a good grade.",Syllogism,Syllogism
I studied and got a good grade.,Syllogism,Syllogism
"Therefore, studying leads to a good grade.",Syllogism,Syllogism
All apples come from trees.,Syllogism,Syllogism
This fruit is an apple.,Syllogism,Syllogism
"Therefore, this fruit comes from a tree.",Syllogism,Syllogism
All mammals are warm-blooded animals.,Syllogism,Syllogism
blue whale is a mammal.,Syllogism,Syllogism
the blue whale is a warm-blooded animal.,Syllogism,Syllogism
Every student who studies hard gets good grades.,Syllogism,Syllogism
always studies hard.,Syllogism,Syllogism
Jenny will get good grades.,Syllogism,Syllogism
"If it is sunny, the beach will be crowded.",Syllogism,Syllogism
is sunny.,Syllogism,Syllogism
the beach will be crowded.,Syllogism,Syllogism
"If you exercise regularly, you will be healthy.",Syllogism,Syllogism
Sarah will be healthy.,Syllogism,Syllogism
Every citizen has the duty to pay taxes.,Syllogism,Syllogism
is a citizen.,Syllogism,Syllogism
Mary has the duty to pay taxes.,Syllogism,Syllogism
is a fruit.,Syllogism,Syllogism
this is an apple.,Syllogism,Syllogism
"If it rains, the grass will be wet.",Syllogism,Syllogism
is raining.,Syllogism,Syllogism
the grass is wet.,Syllogism,Syllogism
is a man.,Syllogism,Syllogism
"If you study hard, you will pass the test.",Syllogism,Syllogism
studied hard.,Syllogism,Syllogism
John passed the test.,Syllogism,Syllogism
"All men are mortal, Socrates is a man, therefore Socrates is mortal.",Syllogism,Syllogism
"All mammals have hair, whales are mammals, therefore whales have hair.",Syllogism,Syllogism
"If A is B and B is C, then A is C.",Syllogism,Syllogism
"No mammals lay eggs, a platypus is a mammal, therefore a platypus does not lay eggs.",Syllogism,Syllogism
"All students with good attendance receive a perfect attendance award, Maria has good attendance, therefore Maria will receive a perfect attendance award.",Syllogism,Syllogism
"If it's raining, then the sidewalks are wet. It's raining, therefore the sidewalks are wet.",Syllogism,Syllogism
"All cats have fur, Garfield is a cat, therefore Garfield has fur.",Syllogism,Syllogism
"If you study hard, you will get good grades. Sarah studies hard, therefore Sarah will get good grades.",Syllogism,Syllogism
"All cars need gas to run, this car needs gas to run, therefore this car is a traditional car.",Syllogism,Syllogism
"If you practice your instrument daily, you will improve your skills. Sally practices her instrument daily, therefore Sally's skills have improved.",Syllogism,Syllogism
"Therefore, elephants have hair.",Syllogism,Syllogism
Every race car is fast.,Syllogism,Syllogism
This car is a race car.,Syllogism,Syllogism
"Therefore, this car is fast.",Syllogism,Syllogism
All cats are carnivores.,Syllogism,Syllogism
Fluffy is a cat.,Syllogism,Syllogism
"Therefore, Fluffy is a carnivore.",Syllogism,Syllogism
"If it is a sunny day, the pool will be open.",Syllogism,Syllogism
It is a sunny day.,Syllogism,Syllogism
"Therefore, the pool is open.",Syllogism,Syllogism
Every bird has feathers.,Syllogism,Syllogism
"If you study hard, you will get good grades.",Syllogism,Syllogism
Tom studied hard.,Syllogism,Syllogism
"Therefore, Tom will get good grades.",Syllogism,Syllogism
All roses are flowers.,Syllogism,Syllogism
This is a rose.,Syllogism,Syllogism
"Therefore, this is a flower.",Syllogism,Syllogism
Mary exercises regularly.,Syllogism,Syllogism
"Therefore, Mary is healthy.",Syllogism,Syllogism
John is a basketball player.,Syllogism,Syllogism
"Therefore, John is tall.",Syllogism,Syllogism
"All men are mortal. Socrates is a man. Therefore, Socrates is mortal.",Syllogism,Syllogism
"If it rains, the ground will be wet. The ground is wet. Therefore, it must have rained.",Syllogism,Syllogism
"Birds have feathers. Penguins are birds. Therefore, penguins have feathers.",Syllogism,Syllogism
"Everyone who goes to college obtains a degree. Samantha went to college. Therefore, Samantha obtained a degree.",Syllogism,Syllogism
"If a substance is made of atoms, then it is matter. Water is made of atoms. Therefore, water is matter.",Syllogism,Syllogism
"No cats are reptiles. All lizards are reptiles. Therefore, no cats are lizards.",Syllogism,Syllogism
"All mammals have hair. Whales are mammals. Therefore, whales have hair.",Syllogism,Syllogism
"John is taller than Mark. Mark is taller than Mary. Therefore, John is taller than Mary.",Syllogism,Syllogism
