,sentence,rhetoric
"If it is raining, the grass is wet.",Syllogism,Syllogism
"If it is sunny, the ice cream will melt.",Syllogism,Syllogism
the ice cream will melt.,Syllogism,Syllogism
dolphins are animals.,Syllogism,Syllogism
Jennifer will be healthy.,Syllogism,Syllogism
"Therefore, dogs have fur.",Syllogism,Syllogism
"If it's raining, the ground is wet.",Syllogism,Syllogism
Plants need sunlight to grow.,Syllogism,Syllogism
Sunflowers are plants.,Syllogism,Syllogism
"Therefore, sunflowers need sunlight to grow.",Syllogism,Syllogism
"If it's a bird, it has wings.",Syllogism,Syllogism
A duck is a bird.,Syllogism,Syllogism
"Therefore, a duck has wings.",Syllogism,Syllogism
Iron is a metal.,Syllogism,Syllogism
Gold is a metal.,Syllogism,Syllogism
"Therefore, gold is made of iron.",Syllogism,Syllogism
All successful people are hard workers.,Syllogism,Syllogism
Michelle is a hard worker.,Syllogism,Syllogism
"Therefore, Michelle is a successful person.",Syllogism,Syllogism
"If it has four legs and barks, it's a dog.",Syllogism,Syllogism
Bella has four legs and barks.,Syllogism,Syllogism
"Therefore, Bella is a dog.",Syllogism,Syllogism
"If it's a triangle, it has three sides.",Syllogism,Syllogism
squirrels have fur.,Syllogism,Syllogism
All students must pass the final exam to pass the course.,Syllogism,Syllogism
John must pass the final exam to pass the course.,Syllogism,Syllogism
"If it is raining, then the grass is wet.",Syllogism,Syllogism
grass is wet.,Syllogism,Syllogism
All water freezes below 0°C.,Syllogism,Syllogism
liquid freezes below 0°C.,Syllogism,Syllogism
this liquid must be water.,Syllogism,Syllogism
"If Bill is taller than Alice, and Alice is taller than Sarah, then Bill is taller than Sarah.",Syllogism,Syllogism
is taller than Alice.,Syllogism,Syllogism
Bill is taller than Sarah.,Syllogism,Syllogism
animal has feathers.,Syllogism,Syllogism
this animal is a bird.,Syllogism,Syllogism
"If a car is full of gas, it can travel long distances.",Syllogism,Syllogism
car can travel long distances.,Syllogism,Syllogism
this car must be full of gas.,Syllogism,Syllogism
All humans have brains.,Syllogism,Syllogism
person is a human.,Syllogism,Syllogism
this person has a brain.,Syllogism,Syllogism
"If something is a vegetable, it is healthy.",Syllogism,Syllogism
spinach is healthy.,Syllogism,Syllogism
All successful athletes are hard-working.,Syllogism,Syllogism
Williams is a successful athlete.,Syllogism,Syllogism
Serena Williams is hard-working.,Syllogism,Syllogism
"If it is summer, it is hot.",Syllogism,Syllogism
is summer.,Syllogism,Syllogism
it is hot.,Syllogism,Syllogism
Buddy is loyal.,Syllogism,Syllogism
studied hard for her exam.,Syllogism,Syllogism
Sara will get good grades.,Syllogism,Syllogism
All flowers are plants.,Syllogism,Syllogism
roses are plants.,Syllogism,Syllogism
"If a shape has four sides and four angles, it is a square.",Syllogism,Syllogism
shape on the board has four sides and four angles.,Syllogism,Syllogism
the shape on the board is a square.,Syllogism,Syllogism
"Every plant needs water to survive. This flower is a plant. Therefore, this flower needs water to survive.",Syllogism,Syllogism
"If the bakery is open, there will be fresh bread. The bakery is open. Therefore, there is fresh bread.",Syllogism,Syllogism
"Love is blind. John is in love. Therefore, John is blind.",Syllogism,Syllogism
"Every student who studies hard gets good grades. Maria studies hard. Therefore, Maria will get good grades.",Syllogism,Syllogism
"If it is raining, then the grass will be wet. It is raining. Therefore, the grass is wet.",Syllogism,Syllogism
"If all fruits are healthy, and apples are fruits, then apples are healthy.",Syllogism,Syllogism
"All mammals have fur. A dog is a mammal. Therefore, a dog has fur.",Syllogism,Syllogism
"If all squares have four sides and this figure has four sides, then this figure is a square.",Syllogism,Syllogism
"If it is Saturday, then the library is closed. Today is Saturday. Therefore, the library is closed.",Syllogism,Syllogism
"If I study hard, I will pass the exam. I studied hard. Therefore, I will pass the exam.",Syllogism,Syllogism
"If it is raining, then the ground is wet. The ground is wet. Therefore, it must be raining.",Syllogism,Syllogism
"All plants need sunlight to survive. Sunflowers are plants. Therefore, sunflowers need sunlight to survive.",Syllogism,Syllogism
"If it is a mammal, it is a warm-blooded animal. Bears are warm-blooded animals. Therefore, bears are mammals.",Syllogism,Syllogism
"All students need to take courses in math. John is a student. Therefore, John needs to take a course in math.",Syllogism,Syllogism
"If it is a bird, it has wings. An ostrich is a bird. Therefore, an ostrich has wings.",Syllogism,Syllogism
"If it is a dog, it is a mammal. Poodles are dogs. Therefore, poodles are mammals.",Syllogism,Syllogism
"All rulers are instruments used for measuring. A protractor is a ruler. Therefore, a protractor is an instrument used for measuring.",Syllogism,Syllogism
