,sentence,rhetoric
"All dogs are animals. All animals need food to survive. Therefore, all dogs need food to survive.",Syllogism,Syllogism
"If an angle is a right angle, then it measures 90 degrees. Angle A measures 90 degrees. Therefore, angle A is a right angle.",Syllogism,Syllogism
is a human.,Syllogism,Syllogism
"If it is raining, then the ground is wet.",Syllogism,Syllogism
Every mammal has a heart.,Syllogism,Syllogism
tiger is a mammal.,Syllogism,Syllogism
a tiger has a heart.,Syllogism,Syllogism
"If I eat breakfast, I will have more energy.",Syllogism,Syllogism
ate breakfast.,Syllogism,Syllogism
I have more energy.,Syllogism,Syllogism
All cars have engines.,Syllogism,Syllogism
vehicle is a car.,Syllogism,Syllogism
this vehicle has an engine.,Syllogism,Syllogism
"If I exercise regularly, I will be healthier.",Syllogism,Syllogism
exercise regularly.,Syllogism,Syllogism
I am healthier.,Syllogism,Syllogism
"If the team practices hard, they will win the championship.",Syllogism,Syllogism
team practiced hard.,Syllogism,Syllogism
the team will win the championship.,Syllogism,Syllogism
Every country has laws.,Syllogism,Syllogism
United States is a country.,Syllogism,Syllogism
the United States has laws.,Syllogism,Syllogism
"If I study for the exam, I will get a good grade.",Syllogism,Syllogism
studied for the exam.,Syllogism,Syllogism
I got a good grade.,Syllogism,Syllogism
"All mammals have fur. Cats are mammals. Therefore, cats have fur.",Syllogism,Syllogism
"If it is raining, the ground will be wet. The ground is wet. Therefore, it must be raining.",Syllogism,Syllogism
"We must be careful about what we eat. After all, we are what we eat.",Syllogism,Syllogism
"He is either lying or telling the truth. If he is not lying, then he must be telling the truth. Therefore, he is either lying or telling the truth.",Syllogism,Syllogism
"If we ban guns, then there will be less violence. There is still a lot of violence. Therefore, banning guns will not solve the problem.",Syllogism,Syllogism
"All flowers have petals. Roses are flowers. Therefore, roses have petals.",Syllogism,Syllogism
"If you practice every day, you will improve. You have improved. So you must have been practicing every day.",Syllogism,Syllogism
"If you do not study, you will fail the test. You did not fail the test. Therefore, you must have studied.",Syllogism,Syllogism
"All birds can fly. Penguins are birds. Therefore, penguins can fly.",Syllogism,Syllogism
"If you want to be a writer, you must read a lot. You read a lot. So you must want to be a writer.",Syllogism,Syllogism
All mammals are vertebrates.,Syllogism,Syllogism
humans are vertebrates.,Syllogism,Syllogism
"If a food is spicy, then it will make your nose run.",Syllogism,Syllogism
food is spicy.,Syllogism,Syllogism
this food will make your nose run.,Syllogism,Syllogism
creature is a penguin.,Syllogism,Syllogism
this creature has feathers.,Syllogism,Syllogism
All plants need sunlight to survive.,Syllogism,Syllogism
maple tree in my backyard is a plant.,Syllogism,Syllogism
the maple tree needs sunlight to survive.,Syllogism,Syllogism
"If all the ingredients are fresh, then the dish will be delicious.",Syllogism,Syllogism
the ingredients for this dish are fresh.,Syllogism,Syllogism
this dish will be delicious.,Syllogism,Syllogism
All responsible drivers use their turn signals.,Syllogism,Syllogism
is a responsible driver.,Syllogism,Syllogism
Maria uses her turn signals.,Syllogism,Syllogism
"If it's raining, then the ground is wet.",Syllogism,Syllogism
raining today.,Syllogism,Syllogism
the ground is wet.,Syllogism,Syllogism
All libraries have books.,Syllogism,Syllogism
place has books.,Syllogism,Syllogism
this place is a library.,Syllogism,Syllogism
"If people eat healthy, they will feel better.",Syllogism,Syllogism
eat healthy.,Syllogism,Syllogism
I will feel better.,Syllogism,Syllogism
All Orange Is the New Black fans love Crazy Eyes.,Syllogism,Syllogism
is an Orange Is the New Black fan.,Syllogism,Syllogism
Jenna loves Crazy Eyes.,Syllogism,Syllogism
"All mammals are animals. Dogs are mammals. Therefore, dogs are animals.",Syllogism,Syllogism
"All Shakespeare's plays are tragedies. Romeo and Juliet is a play by Shakespeare. Therefore, Romeo and Juliet is a tragedy.",Syllogism,Syllogism
"If it is raining, then the ground is wet. The ground is wet. Therefore, it is raining.",Syllogism,Syllogism
"All A+ students study hard. Jane is an A+ student. Therefore, Jane studies hard.",Syllogism,Syllogism
"If a shape has three sides and three angles, then it is a triangle. This shape has three sides and three angles. Therefore, this shape is a triangle.",Syllogism,Syllogism
"All fruits have seeds. Oranges are fruits. Therefore, oranges have seeds.",Syllogism,Syllogism
"If it is a weekend, then there is no school. It is a weekend. Therefore, there is no school.",Syllogism,Syllogism
"All athletes train regularly. Serena Williams is an athlete. Therefore, Serena Williams trains regularly.",Syllogism,Syllogism
"If someone is allergic to peanuts, they should not eat peanut butter. Frank is allergic to peanuts. Therefore, Frank should not eat peanut butter.",Syllogism,Syllogism
"All dogs are mammals. Fido is a dog. Therefore, Fido is a mammal.",Syllogism,Syllogism
"Nothing that is dead can come back to life. The dinosaur is dead. Therefore, the dinosaur cannot come back to life.",Syllogism,Syllogism
"Every student must pass the final exam to graduate. Jane is a student. Therefore, Jane must pass the final exam to graduate.",Syllogism,Syllogism
"All good leaders possess strong communication skills. Michelle is a good leader. Therefore, Michelle possesses strong communication skills.",Syllogism,Syllogism
"If you study, you will get a good grade. You did not study. Therefore, you will not get a good grade.",Syllogism,Syllogism
"All politicians are known to tell lies. Rachel is a politician. Therefore, Rachel is known to tell lies.",Syllogism,Syllogism
"All successful companies have a strong marketing strategy. Amazon is a successful company. Therefore, Amazon has a strong marketing strategy.",Syllogism,Syllogism
"If you want to get into shape, you must exercise regularly. Jim exercises regularly. Therefore, Jim wants to get into shape.",Syllogism,Syllogism
"Every triangle has three sides. ABC is a triangle. Therefore, ABC has three sides.",Syllogism,Syllogism
"If it rains, the grass will be wet. It is raining. Therefore, the grass is wet.",Syllogism,Syllogism
"All birds have wings. Penguins are birds. Therefore, penguins have wings.",Syllogism,Syllogism
"If Sue is a vegetarian, then she does not eat meat. Sue is a vegetarian. Therefore, she does not eat meat.",Syllogism,Syllogism
"All cats have fur. Mittens is a cat. Therefore, Mittens has fur.",Syllogism,Syllogism
"If all A are B and all B are C, then all A are C.",Syllogism,Syllogism
"Every human has a mother. Jane is a human. Therefore, Jane has a mother.",Syllogism,Syllogism
"If you study hard, you will get good grades. Samantha studied hard. Therefore, Samantha got good grades.",Syllogism,Syllogism
"All dogs are animals. Max is a dog. Therefore, Max is an animal.",Syllogism,Syllogism
"If a shape is a triangle, then it has three sides. This shape has three sides. Therefore, this shape is a triangle.",Syllogism,Syllogism
is a politician.,Syllogism,Syllogism
Joe makes promises.,Syllogism,Syllogism
All dogs are loyal.,Syllogism,Syllogism
Max is loyal.,Syllogism,Syllogism
"If all apples are fruit,",Syllogism,Syllogism
all fruit is healthy.,Syllogism,Syllogism
all apples are healthy.,Syllogism,Syllogism
All universities require a college degree.,Syllogism,Syllogism
is a university.,Syllogism,Syllogism
Harvard requires a college degree.,Syllogism,Syllogism
"If it rains, then the grass is wet.",Syllogism,Syllogism
robins have wings.,Syllogism,Syllogism
Diamonds are valuable.,Syllogism,Syllogism
ring has a diamond.,Syllogism,Syllogism
this ring is valuable.,Syllogism,Syllogism
"If I study hard, I will get good grades.",Syllogism,Syllogism
I will get good grades.,Syllogism,Syllogism
All Olympic athletes are highly skilled.,Syllogism,Syllogism
Simone Biles is highly skilled.,Syllogism,Syllogism
"All dogs are mammals. Blackie is a dog. Therefore, Blackie is a mammal.",Syllogism,Syllogism
"If it's raining, then the ground is wet. The ground is wet. Therefore, it must be raining.",Syllogism,Syllogism
"All fruits are healthy. Apples are fruits. Therefore, apples are healthy.",Syllogism,Syllogism
"If you want to be happy, then you should smile. John is smiling. Therefore, John must be happy.",Syllogism,Syllogism
"All birds have feathers. Pigeons are birds. Therefore, pigeons have feathers.",Syllogism,Syllogism
"If you study hard, you will get good grades. Jake studies hard. Therefore, Jake will get good grades.",Syllogism,Syllogism
"All cars have wheels. This vehicle has wheels. Therefore, this vehicle is a car.",Syllogism,Syllogism
"If it is a mammal, then it is a warm-blooded animal. Whales are warm-blooded animals. Therefore, whales are mammals.",Syllogism,Syllogism
"All successful actors are hard-working. Tom Cruise is a successful actor. Therefore, Tom Cruise is hard-working.",Syllogism,Syllogism
"If all men are mortal, and Socrates is a man, then Socrates must be mortal.",Syllogism,Syllogism
"If all birds can fly, then pigeons can fly.",Syllogism,Syllogism
pigeons can fly.,Syllogism,Syllogism
"If it is below 32 degrees Fahrenheit, water will freeze.",Syllogism,Syllogism
temperature is below 32 degrees Fahrenheit.,Syllogism,Syllogism
the water will freeze.,Syllogism,Syllogism
"If all triangles have three sides, and this figure has three sides, then it must be a triangle.",Syllogism,Syllogism
All cars need gas to run.,Syllogism,Syllogism
this vehicle needs gas to run.,Syllogism,Syllogism
All maple trees are deciduous.,Syllogism,Syllogism
tree is a maple tree.,Syllogism,Syllogism
this tree is deciduous.,Syllogism,Syllogism
"If all bakers use flour to make bread, then Millie must use flour to make bread.",Syllogism,Syllogism
is a baker.,Syllogism,Syllogism
Millie uses flour to make bread.,Syllogism,Syllogism
"If it is a weekday, then I have to go to work.",Syllogism,Syllogism
is a weekday.,Syllogism,Syllogism
I have to go to work.,Syllogism,Syllogism
"If something is a triangle, it has three sides.",Syllogism,Syllogism
figure has three sides.,Syllogism,Syllogism
this figure is a triangle.,Syllogism,Syllogism
"If an animal is a penguin, it cannot fly.",Syllogism,Syllogism
is a penguin.,Syllogism,Syllogism
Tux cannot fly.,Syllogism,Syllogism
All students who study hard get good grades.,Syllogism,Syllogism
studies hard.,Syllogism,Syllogism
Samantha will get good grades.,Syllogism,Syllogism
"If it rains, then the ground will be wet.",Syllogism,Syllogism
is currently raining.,Syllogism,Syllogism
All basketball players are athletes.,Syllogism,Syllogism
Bryant is a basketball player.,Syllogism,Syllogism
Kobe Bryant is an athlete.,Syllogism,Syllogism
"If it is winter, then it is cold outside.",Syllogism,Syllogism
is currently winter.,Syllogism,Syllogism
it is cold outside.,Syllogism,Syllogism
"If a shape has four right angles, then it is a square.",Syllogism,Syllogism
shape has four right angles.,Syllogism,Syllogism
My dog is a mammal.,Syllogism,Syllogism
"Therefore, my dog has hair.",Syllogism,Syllogism
Every apple is a fruit.,Syllogism,Syllogism
A Granny Smith is an apple.,Syllogism,Syllogism
"Therefore, a Granny Smith is a fruit.",Syllogism,Syllogism
"If it is raining, the grass will be wet.",Syllogism,Syllogism
"Therefore, the grass is wet.",Syllogism,Syllogism
"Therefore, a penguin has feathers.",Syllogism,Syllogism
All students study.,Syllogism,Syllogism
Jenny is a student.,Syllogism,Syllogism
"Therefore, Jenny studies.",Syllogism,Syllogism
"If I exercise regularly, I will be healthy.",Syllogism,Syllogism
I exercise regularly.,Syllogism,Syllogism
"Therefore, I am healthy.",Syllogism,Syllogism
Every insect has six legs.,Syllogism,Syllogism
A butterfly is an insect.,Syllogism,Syllogism
"Therefore, a butterfly has six legs.",Syllogism,Syllogism
Every library has books.,Syllogism,Syllogism
The public library is a library.,Syllogism,Syllogism
"Therefore, the public library has books.",Syllogism,Syllogism
"If aliens exist, we will have contact with them.",Syllogism,Syllogism
Aliens exist.,Syllogism,Syllogism
"Therefore, we will eventually have contact with them.",Syllogism,Syllogism
Whales are mammals.,Syllogism,Syllogism
"Therefore, whales have hair.",Syllogism,Syllogism
Life on Earth requires water.,Syllogism,Syllogism
The moon has no water.,Syllogism,Syllogism
"Therefore, there is no life on the moon.",Syllogism,Syllogism
All politicians are liars.,Syllogism,Syllogism
Donald Trump is a politician.,Syllogism,Syllogism
"Therefore, Donald Trump is a liar.",Syllogism,Syllogism
Apples are fruits.,Syllogism,Syllogism
"Therefore, apples are healthy.",Syllogism,Syllogism
Sarah studied hard.,Syllogism,Syllogism
"Therefore, Sarah will get good grades.",Syllogism,Syllogism
All love is unconditional.,Syllogism,Syllogism
A parent's love for their child is unconditional.,Syllogism,Syllogism
"Therefore, a parent's love for their child is true love.",Syllogism,Syllogism
"If it's your birthday, then you can have cake.",Syllogism,Syllogism
It is your birthday.,Syllogism,Syllogism
"Therefore, you can have cake.",Syllogism,Syllogism
Mrs. Smith is a teacher.,Syllogism,Syllogism
"Therefore, Mrs. Smith is educated.",Syllogism,Syllogism
"If all humans breathe air, and you are a human, then you must breathe air.",Syllogism,Syllogism
You are a human.,Syllogism,Syllogism
"Therefore, you must breathe air.",Syllogism,Syllogism
No reptiles have fur.,Syllogism,Syllogism
All snakes are reptiles.,Syllogism,Syllogism
"Therefore, no snakes have fur.",Syllogism,Syllogism
"If a creature is a butterfly, then it has wings.",Syllogism,Syllogism
A butterfly is a creature.,Syllogism,Syllogism
"Therefore, a butterfly has wings.",Syllogism,Syllogism
All cats are animals.,Syllogism,Syllogism
Snowball is a cat.,Syllogism,Syllogism
"Therefore, Snowball is an animal.",Syllogism,Syllogism
"If plants get enough sunlight, they will grow.",Syllogism,Syllogism
This plant is getting enough sunlight.,Syllogism,Syllogism
"Therefore, this plant will grow.",Syllogism,Syllogism
"If a company sells organic produce, then it is environmentally responsible.",Syllogism,Syllogism
Whole Foods sells organic produce.,Syllogism,Syllogism
"Therefore, Whole Foods is environmentally responsible.",Syllogism,Syllogism
All actors are performers.,Syllogism,Syllogism
Julia Roberts is an actor.,Syllogism,Syllogism
"Therefore, Julia Roberts is a performer.",Syllogism,Syllogism
cats have hair.,Syllogism,Syllogism
"If it is raining, then the ground will be wet.",Syllogism,Syllogism
Every human has the potential to be successful.,Syllogism,Syllogism
John has the potential to be successful.,Syllogism,Syllogism
All apples have seeds.,Syllogism,Syllogism
fruit in my hand is an apple.,Syllogism,Syllogism
this fruit has seeds.,Syllogism,Syllogism
"If a shape is a square, then it has four sides.",Syllogism,Syllogism
Sarah will get good grades.,Syllogism,Syllogism
John is a liar.,Syllogism,Syllogism
"If an animal has four legs, then it is a mammal.",Syllogism,Syllogism
cat has four legs.,Syllogism,Syllogism
my cat is a mammal.,Syllogism,Syllogism
Every good movie has a good storyline.,Syllogism,Syllogism
movie has a good storyline.,Syllogism,Syllogism
this movie is a good movie.,Syllogism,Syllogism
Major premise: All mammals have hair.,Syllogism,Syllogism
Minor premise: Dogs are mammals.,Syllogism,Syllogism
"Conclusion: Therefore, dogs have hair.",Syllogism,Syllogism
Major premise: All falcons have wings.,Syllogism,Syllogism
Minor premise: This bird is a falcon.,Syllogism,Syllogism
"Conclusion: Therefore, this bird has wings.",Syllogism,Syllogism
Major premise: All human beings have the capacity for reason.,Syllogism,Syllogism
Minor premise: John is a human being.,Syllogism,Syllogism
"Conclusion: Therefore, John has the capacity for reason.",Syllogism,Syllogism
Major premise: All successful people work hard.,Syllogism,Syllogism
Minor premise: Jane is successful.,Syllogism,Syllogism
"Conclusion: Therefore, Jane works hard.",Syllogism,Syllogism
Major premise: All triangles have three sides.,Syllogism,Syllogism
Minor premise: This shape is a triangle.,Syllogism,Syllogism
"Conclusion: Therefore, this shape has three sides.",Syllogism,Syllogism
"Major premise: If it rains, then the roads will be wet.",Syllogism,Syllogism
Minor premise: It is raining.,Syllogism,Syllogism
"Conclusion: Therefore, the roads are wet.",Syllogism,Syllogism
Major premise: All birds have feathers.,Syllogism,Syllogism
Minor premise: This animal is a bird.,Syllogism,Syllogism
"Conclusion: Therefore, this animal has feathers.",Syllogism,Syllogism
"Major premise: If hot chocolate is made with milk, then it is rich and creamy.",Syllogism,Syllogism
Minor premise: This hot chocolate is made with milk.,Syllogism,Syllogism
"Conclusion: Therefore, this hot chocolate is rich and creamy.",Syllogism,Syllogism
Major premise: All science students are curious.,Syllogism,Syllogism
Minor premise: Tom is a science student.,Syllogism,Syllogism
"Conclusion: Therefore, Tom is curious.",Syllogism,Syllogism
"Major premise: If plants receive enough sunlight, then they will grow.",Syllogism,Syllogism
Minor premise: This plant is receiving enough sunlight.,Syllogism,Syllogism
"Conclusion: Therefore, this plant will grow.",Syllogism,Syllogism
humans have hair.,Syllogism,Syllogism
"If A is true, B must also be true.",Syllogism,Syllogism
is true.,Syllogism,Syllogism
B is true.,Syllogism,Syllogism
All metal conducts electricity.,Syllogism,Syllogism
is a metal.,Syllogism,Syllogism
copper conducts electricity.,Syllogism,Syllogism
"If it is raining, the ground will be wet.",Syllogism,Syllogism
it must have been raining.,Syllogism,Syllogism
All cats have fur.,Syllogism,Syllogism
Fluffy has fur.,Syllogism,Syllogism
"If someone is 18 years old, they are legally an adult.",Syllogism,Syllogism
is 18 years old.,Syllogism,Syllogism
Samantha is legally an adult.,Syllogism,Syllogism
"If a shape has four sides, it is a quadrilateral.",Syllogism,Syllogism
square has four sides.,Syllogism,Syllogism
a square is a quadrilateral.,Syllogism,Syllogism
Matt is a liar.,Syllogism,Syllogism
"If I eat too much candy, I will get a stomach ache.",Syllogism,Syllogism
ate a lot of candy.,Syllogism,Syllogism
I will likely get a stomach ache.,Syllogism,Syllogism
All mammals are animals.,Syllogism,Syllogism
all dogs are animals.,Syllogism,Syllogism
"If it's your job, then you get paid.",Syllogism,Syllogism
is your job.,Syllogism,Syllogism
you will get paid.,Syllogism,Syllogism
is a vegetable.,Syllogism,Syllogism
broccoli is healthy.,Syllogism,Syllogism
you will pass the test.,Syllogism,Syllogism
it is a triangle.,Syllogism,Syllogism
All birds can fly.,Syllogism,Syllogism
penguins can fly.,Syllogism,Syllogism
"If it is made of milk, then it is a dairy product.",Syllogism,Syllogism
is made of milk.,Syllogism,Syllogism
cheese is a dairy product.,Syllogism,Syllogism
All songs have lyrics.,Syllogism,Syllogism
song has lyrics.,Syllogism,Syllogism
it is a song.,Syllogism,Syllogism
"If it has fur, it is a mammal.",Syllogism,Syllogism
animal has fur.,Syllogism,Syllogism
it is a mammal.,Syllogism,Syllogism
All humans are mortal beings.,Syllogism,Syllogism
Socrates is a mortal being.,Syllogism,Syllogism
bouquet has roses.,Syllogism,Syllogism
this bouquet has flowers.,Syllogism,Syllogism
platypus is a mammal.,Syllogism,Syllogism
a platypus does not lay eggs.,Syllogism,Syllogism
Everyone born in the United States is an American citizen.,Syllogism,Syllogism
was born in the United States.,Syllogism,Syllogism
John is an American citizen.,Syllogism,Syllogism
Every student in this class passed the exam.,Syllogism,Syllogism
is a student in this class.,Syllogism,Syllogism
Samantha passed the exam.,Syllogism,Syllogism
dolphins have hair.,Syllogism,Syllogism
"If my alarm goes off, then I will wake up.",Syllogism,Syllogism
alarm went off.,Syllogism,Syllogism
I woke up.,Syllogism,Syllogism
"Every mammal is warm-blooded. A dog is a mammal. Therefore, a dog is warm-blooded.",Syllogism,Syllogism
"If you eat too much candy, you will get a stomachache. Sarah ate too much candy. Therefore, Sarah will get a stomachache.",Syllogism,Syllogism
"All birds have feathers. A penguin is a bird. Therefore, a penguin has feathers.",Syllogism,Syllogism
"If you study hard, then you will pass the quiz. Sam studied hard. Therefore, Sam will pass the quiz.",Syllogism,Syllogism
"All cats like to nap. Mittens is a cat. Therefore, Mittens likes to nap.",Syllogism,Syllogism
"If it is raining, then the ground will be wet. It is raining. Therefore, the ground is wet.",Syllogism,Syllogism
"All triangles have three sides. This shape has three sides. Therefore, this shape is a triangle.",Syllogism,Syllogism
"If you run every day, you will become a faster runner. Jake runs every day. Therefore, Jake will become a faster runner.",Syllogism,Syllogism
"All planets revolve around the sun. Earth is a planet. Therefore, Earth revolves around the sun.",Syllogism,Syllogism
cat is a mammal.,Syllogism,Syllogism
my cat has hair.,Syllogism,Syllogism
robin is a bird.,Syllogism,Syllogism
a robin has feathers.,Syllogism,Syllogism
is a student who studies hard.,Syllogism,Syllogism
Jane will get good grades.,Syllogism,Syllogism
All apples are fruit.,Syllogism,Syllogism
apple is an apple.,Syllogism,Syllogism
this apple is a fruit.,Syllogism,Syllogism
All trees are plants.,Syllogism,Syllogism
trees are trees.,Syllogism,Syllogism
oak trees are plants.,Syllogism,Syllogism
All dogs have fur.,Syllogism,Syllogism
Buddy has fur.,Syllogism,Syllogism
All nurses are caregivers.,Syllogism,Syllogism
is a nurse.,Syllogism,Syllogism
Sue is a caregiver.,Syllogism,Syllogism
shape is a triangle.,Syllogism,Syllogism
this shape has three sides.,Syllogism,Syllogism
All cars have tires.,Syllogism,Syllogism
car is a car.,Syllogism,Syllogism
my car has tires.,Syllogism,Syllogism
All reptiles lay eggs.,Syllogism,Syllogism
crocodiles lay eggs.,Syllogism,Syllogism
elephants have hair.,Syllogism,Syllogism
"If it is raining, then the grass will be wet.",Syllogism,Syllogism
"If A is larger than B, and B is larger than C,",Syllogism,Syllogism
A is larger than C.,Syllogism,Syllogism
ostrich is a bird.,Syllogism,Syllogism
an ostrich has feathers.,Syllogism,Syllogism
"If you study hard, then you will get good grades.",Syllogism,Syllogism
you will get good grades.,Syllogism,Syllogism
All successful businesses have innovative ideas.,Syllogism,Syllogism
is a successful business.,Syllogism,Syllogism
Apple has innovative ideas.,Syllogism,Syllogism
"If a person has a PhD, then they are knowledgeable.",Syllogism,Syllogism
has a PhD.,Syllogism,Syllogism
Samantha is knowledgeable.,Syllogism,Syllogism
All fruits are healthy for you.,Syllogism,Syllogism
apple is a fruit.,Syllogism,Syllogism
an apple is healthy for you.,Syllogism,Syllogism
"If you exercise regularly, then you will be physically fit.",Syllogism,Syllogism
Sofia is physically fit.,Syllogism,Syllogism
"All cats are mammals. Garfield is a cat. Therefore, Garfield is a mammal.",Syllogism,Syllogism
"No mammals lay eggs. A platypus lays eggs. Therefore, a platypus is not a mammal.",Syllogism,Syllogism
"All mothers are women. Susan is a mother. Therefore, Susan is a woman.",Syllogism,Syllogism
"If all squares are rectangles, and all rectangles have four sides, then all squares have four sides.",Syllogism,Syllogism
"Plants need water to survive. Cacti are plants. Therefore, cacti need water to survive.",Syllogism,Syllogism
"If we eat too much sugar, we will get cavities. Sarah eats a lot of sugar. Therefore, Sarah may get cavities.",Syllogism,Syllogism
"All fruits have seeds. Apples are fruits. Therefore, apples have seeds.",Syllogism,Syllogism
"If Mary is a lawyer, then she has a law degree. Mary is a lawyer. Therefore, Mary has a law degree.",Syllogism,Syllogism
"If all birds have feathers, and ostriches are birds, then ostriches have feathers.",Syllogism,Syllogism
All humans are mortal,Syllogism,Syllogism
Socrates is human,Syllogism,Syllogism
All birds have feathers,Syllogism,Syllogism
Penguins are birds,Syllogism,Syllogism
No mammals lay eggs,Syllogism,Syllogism
Whales are mammals,Syllogism,Syllogism
"Therefore, whales do not lay eggs.",Syllogism,Syllogism
"If it is raining, then the ground will be wet",Syllogism,Syllogism
It is raining,Syllogism,Syllogism
All carbohydrates are made up of sugars,Syllogism,Syllogism
Sugar is a carbohydrate,Syllogism,Syllogism
"Therefore, sugar is made up of sugars.",Syllogism,Syllogism
All scientists conduct experiments,Syllogism,Syllogism
Marie Curie was a scientist,Syllogism,Syllogism
"Therefore, Marie Curie conducted experiments.",Syllogism,Syllogism
"If it is a weekday, then I have to work",Syllogism,Syllogism
Today is a weekday,Syllogism,Syllogism
"Therefore, I have to work today.",Syllogism,Syllogism
"Every time I eat ice cream, I get a brain freeze",Syllogism,Syllogism
I just ate ice cream,Syllogism,Syllogism
"Therefore, I will get a brain freeze.",Syllogism,Syllogism
All cats hate water,Syllogism,Syllogism
Fluffy is a cat,Syllogism,Syllogism
"Therefore, Fluffy hates water.",Syllogism,Syllogism
"If you study diligently, you will get good grades",Syllogism,Syllogism
Jane studies diligently,Syllogism,Syllogism
"Therefore, Jane will get good grades.",Syllogism,Syllogism
chickens are birds.,Syllogism,Syllogism
some chickens have feathers.,Syllogism,Syllogism
some dogs have hair.,Syllogism,Syllogism
All flowers need water to survive.,Syllogism,Syllogism
roses need water to survive.,Syllogism,Syllogism
All students need sleep to perform well on exams.,Syllogism,Syllogism
Tom needs sleep to perform well on exams.,Syllogism,Syllogism
